,link,header,article,author,date
6,/technology/lg-s-latest-connected-white-goods-are-smart-but-not-too-smart-20200420-p54lcn.html,"LG's latest connected white goods are smart, but not too smart","Remember a few years back when we first heard of the ""internet refrigerator"" and mocked it mercilessly? Well, in the 20 years since LG introduced the first smart fridge, tech companies have worked out what people actually want from smart products, beyond ""it connects to the internet, I guess"". To see what kinds of advancements have been made, and because my old dishwasher was an agent of chaos, I decked my apartment out with new smart appliances and discovered that it's the little things that make the most difference. The appliances I got were the $1749 LG XD3A25BS dishwasher and the $1439 WV9-1409W TwinWash washing machine. Neither of them have particularly flashy smart features: they don’t have TVs or anything like that. But their features are ones I have actually used, unlike the smart lights whose colours I never change. Tech companies have worked out what people actually want from smart products. Even without the smart features, this is a ridiculously good and intelligent washing machine. It’s got a big 9kg washer on top and a small 2kg washing drawer on the bottom for delicates, sportswear, or when you just really need to clean one particular outfit. With the smart features I can download new cycles; as I did to wash a blanket or a load of jeans. (It would be nice if brands could start making custom cycles that are particularly suited to their unusual fabrics, but presumably that feature could be added at any time.) Back in the before, when we could go out and do things, the remote start feature let me tell it to begin washing once I knew what time I’d get home. It’s also the little things, like getting the notification to my phoneasking whether I would like to add fabric softener (I would not, but appreciate being asked). The notification that the wash is done is particularly useful, because it stays on the lock screen until I address it, which means my clothes haven’t been left to go mouldy recently. The dishwasher is also amazing. Not just because it isn't operated by a dial of mystery like my old Smeg — 100 notches all the way around, but only one will clean the dishes, and there is no way to know which — it’s amazing because of its intelligent steaming function and movable top shelf. It’s also ridiculously quiet, to the point that I’m never 100 per cent sure it’s on, but the dishes come out clean anyway. The connected features on this are also fairly basic. I get a notification that the cycle is done, can remote start it, download new cycles, change the settings, be reminded when it needs to be cleaned or have more rinse aid, and diagnose any potential problems with it by holding my phone close. For most people, and most brands, it’s still the internet fridge that is the pinnacle of smart whitegoods. But those fridges only come in two sizes — stupidly large, and massive — and thus don't suit anyone with a family smaller than five. And, be honest, how often would you actually remember to check the camera inside your fridge? Would you rather watch that YouTube video on your fridge, which is usually in the corner of the kitchen, or on an iPad near where you’re actually cooking? For me, when it comes to smart home, it’s better to focus on the features that will actually be useful, rather than those that are needlessly flashy and jack the price up considerably. My time with these whitegoods has shown me that it’s the quiet, useful intelligence that really matters. Alice is a freelance journalist, producer and presenter. Copyright © 2020", Alice Clarke ,"April 22, 2020"
7,/technology/lg-s-latest-connected-white-goods-are-smart-but-not-too-smart-20200420-p54lcn.html,"LG's latest connected white goods are smart, but not too smart","Remember a few years back when we first heard of the ""internet refrigerator"" and mocked it mercilessly? Well, in the 20 years since LG introduced the first smart fridge, tech companies have worked out what people actually want from smart products, beyond ""it connects to the internet, I guess"". To see what kinds of advancements have been made, and because my old dishwasher was an agent of chaos, I decked my apartment out with new smart appliances and discovered that it's the little things that make the most difference. The appliances I got were the $1749 LG XD3A25BS dishwasher and the $1439 WV9-1409W TwinWash washing machine. Neither of them have particularly flashy smart features: they don’t have TVs or anything like that. But their features are ones I have actually used, unlike the smart lights whose colours I never change. Tech companies have worked out what people actually want from smart products. Even without the smart features, this is a ridiculously good and intelligent washing machine. It’s got a big 9kg washer on top and a small 2kg washing drawer on the bottom for delicates, sportswear, or when you just really need to clean one particular outfit. With the smart features I can download new cycles; as I did to wash a blanket or a load of jeans. (It would be nice if brands could start making custom cycles that are particularly suited to their unusual fabrics, but presumably that feature could be added at any time.) Back in the before, when we could go out and do things, the remote start feature let me tell it to begin washing once I knew what time I’d get home. It’s also the little things, like getting the notification to my phoneasking whether I would like to add fabric softener (I would not, but appreciate being asked). The notification that the wash is done is particularly useful, because it stays on the lock screen until I address it, which means my clothes haven’t been left to go mouldy recently. The dishwasher is also amazing. Not just because it isn't operated by a dial of mystery like my old Smeg — 100 notches all the way around, but only one will clean the dishes, and there is no way to know which — it’s amazing because of its intelligent steaming function and movable top shelf. It’s also ridiculously quiet, to the point that I’m never 100 per cent sure it’s on, but the dishes come out clean anyway. The connected features on this are also fairly basic. I get a notification that the cycle is done, can remote start it, download new cycles, change the settings, be reminded when it needs to be cleaned or have more rinse aid, and diagnose any potential problems with it by holding my phone close. For most people, and most brands, it’s still the internet fridge that is the pinnacle of smart whitegoods. But those fridges only come in two sizes — stupidly large, and massive — and thus don't suit anyone with a family smaller than five. And, be honest, how often would you actually remember to check the camera inside your fridge? Would you rather watch that YouTube video on your fridge, which is usually in the corner of the kitchen, or on an iPad near where you’re actually cooking? For me, when it comes to smart home, it’s better to focus on the features that will actually be useful, rather than those that are needlessly flashy and jack the price up considerably. My time with these whitegoods has shown me that it’s the quiet, useful intelligence that really matters. Alice is a freelance journalist, producer and presenter. Copyright © 2020", Alice Clarke ,"April 22, 2020"
8,/technology/stay-healthy-at-home-with-a-family-friendly-survival-of-the-fittest-20200420-p54lbh.html,Stay healthy at home with a family friendly survival of the fittest,"Buying FitBits for my family when we're stuck at home might sound crazy, but in the end it took a little healthy competition to get us all off the couch. A FitBit and a bit of encouragement can help inform healthy habits.Credit:Adam Turner Having worked from home for 15 years, I appreciate the importance of going for a walk every day; either along the creek near my house or, when the weather turns sour, on the treadmill. If I don't walk my back plays up, but walking is good for both body and mind. I've tested FitBits before but never really felt they were for me. Of course now my teenage kids are studying from home I'm ""encouraging"" — by which I mean pestering — them to develop healthy habits. To be honest we're not a sporty family at the best of times, and it can be a struggle to get everyone out of the house. When I first suggested we all get FitBit watches, I expected my family to put up a fight but thankfully they saw the wisdom in it. My wife and I opted for the first-gen FitBit Versa while the kids went for the more ostentatious FitBit Ionic. They're not the latest and greatest FitBit models, but we got them at a good price and they're more than enough to meet our needs. So far it's worked even better than I'd hoped. It's been much easier to get the kids outside for a walk. If they miss my lunchtime walk, they're voluntarily jumping on the treadmill in the evening – something I never thought I'd see. They're also burning off energy with a good cardio session playing Just Dance on the Wii. It turns out the trick for my family is turning it into a competition – unlocking achievement badges and becoming FitBit buddies so we can see each other's steps. I'd say it's less about beating everyone else and more about feeling that you're responsible to someone so you don't want to let down the team. Now we're now stuck at home we're actually exercising more than ever, developing good habits which hopefully will help keep us fit once we're free to leave the house whenever we want. Adam Turner is an award-winning Australian technology journalist and co-host of weekly podcast Vertical Hold: Behind The Tech News. Copyright © 2020", Adam Turner ,"April 21, 2020"
9,/technology/stay-healthy-at-home-with-a-family-friendly-survival-of-the-fittest-20200420-p54lbh.html,Stay healthy at home with a family friendly survival of the fittest,"Buying FitBits for my family when we're stuck at home might sound crazy, but in the end it took a little healthy competition to get us all off the couch. A FitBit and a bit of encouragement can help inform healthy habits.Credit:Adam Turner Having worked from home for 15 years, I appreciate the importance of going for a walk every day; either along the creek near my house or, when the weather turns sour, on the treadmill. If I don't walk my back plays up, but walking is good for both body and mind. I've tested FitBits before but never really felt they were for me. Of course now my teenage kids are studying from home I'm ""encouraging"" — by which I mean pestering — them to develop healthy habits. To be honest we're not a sporty family at the best of times, and it can be a struggle to get everyone out of the house. When I first suggested we all get FitBit watches, I expected my family to put up a fight but thankfully they saw the wisdom in it. My wife and I opted for the first-gen FitBit Versa while the kids went for the more ostentatious FitBit Ionic. They're not the latest and greatest FitBit models, but we got them at a good price and they're more than enough to meet our needs. So far it's worked even better than I'd hoped. It's been much easier to get the kids outside for a walk. If they miss my lunchtime walk, they're voluntarily jumping on the treadmill in the evening – something I never thought I'd see. They're also burning off energy with a good cardio session playing Just Dance on the Wii. It turns out the trick for my family is turning it into a competition – unlocking achievement badges and becoming FitBit buddies so we can see each other's steps. I'd say it's less about beating everyone else and more about feeling that you're responsible to someone so you don't want to let down the team. Now we're now stuck at home we're actually exercising more than ever, developing good habits which hopefully will help keep us fit once we're free to leave the house whenever we want. Adam Turner is an award-winning Australian technology journalist and co-host of weekly podcast Vertical Hold: Behind The Tech News. Copyright © 2020", Adam Turner ,"April 21, 2020"
10,/technology/how-dropbox-and-australian-hackers-uncovered-zoom-s-biggest-flaws-20200421-p54lo7.html,"How Dropbox, and Australian hackers, uncovered Zoom's biggest flaws","One year ago, two Australian hackers found themselves on an eight-hour flight to Singapore to attend a live hacking competition sponsored by Dropbox. At 30,000 feet, with nothing but a slow internet connection, they decided to get a head start by hacking Zoom, a videoconferencing service that they knew was used by many Dropbox employees. The hackers soon uncovered a major security vulnerability in Zoom's software that could have allowed attackers to covertly control certain users' Mac computers. It was precisely the type of bug that security engineers at Dropbox had come to dread from Zoom, according to three former Dropbox engineers. Replay   Now Zoom's videoconferencing service has become the preferred communications platform for hundreds of millions of people sheltering at home, and reports of its privacy and security troubles have proliferated. Zoom's defenders, including big-name Silicon Valley venture capitalists, say the onslaught of criticism is unfair. They argue that Zoom, originally designed for businesses, could not have anticipated a pandemic that would send legions of consumers flocking to its service in the span of a few weeks and using it for purposes — like primary school classes and family celebrations — for which it was never intended. ""I don't think a lot of these things were predictable,"" said Alex Stamos, a former chief security officer at Facebook who recently signed on as a security adviser to Zoom. ""It's like everyone decided to drive their cars on water."" The former Dropbox engineers, however, say Zoom's current woes can be traced back two years or more, and they argue that the company's failure to overhaul its security practices back then put its business clients at risk. Dropbox grew so concerned that vulnerabilities in the videoconferencing system might compromise its own corporate security that the file-hosting giant took on the unusual step of policing Zoom's security practices itself, according to the former engineers, who spoke on the condition of anonymity because they were not authorised to publicly discuss their work. As part of a novel security assessment program for its vendors and partners, Dropbox in 2018 began privately offering rewards to top hackers to find holes in Zoom's software code and that of a few other companies. The former Dropbox engineers said they were stunned by the volume and severity of the security flaws that hackers discovered in Zoom's code; and troubled by Zoom's slowness in fixing them. After Dropbox presented the hackers' findings from the Singapore event to Zoom Video Communications, the California company behind the videoconferencing service, it took more than three months for Zoom to fix the bug, the former engineers said. Zoom patched the vulnerability only after another hacker publicised a different security flaw with the same root cause. Zoom's sudden popularity — nearly 600,000 people downloaded the app on a single day last month — has opened it to increased scrutiny by researchers and journalists and forced the company to grapple with a rash of security incidents. Three weeks ago in the US, the FBI warned that it had received multiple reports of trolls hijacking public school classes on Zoom to display pornography and make threats; malicious attacks known as ""Zoombombing."" Last week, Vice's Motherboard blog reported that security bug brokers were selling access — for $US500,000 — to critical Zoom security flaws that could allow remote access into users' computers. Separately, hackers put up more than half a million Zoom users' passwords and user names for sale on the so-called dark web. On April 1 Eric Yuan, Zoom's chief executive, said the company would devote all of its engineering resources for the next 90 days to shoring up security and privacy. Last week, the company announced a revamped reward program for hackers who find security flaws in its code. Stamos said Zoom was also working on design changes to reduce the potential risks of security flaws and abuses like Zoombombing. Even critics acknowledge that Zoom remains the most user-friendly videoconferencing service on the market and has become a crucial communications tool during the pandemic. Security researchers also praised Zoom for improving its response times; quickly patching recent bugs and removing features that presented privacy risks to consumers. Zoom is hardly the first tech company whose sudden surge in popularity exposed its problems. Microsoft, Twitter, Google, Facebook and Uber have all settled charges related to consumer security or privacy. What is different about Zoom is the unusual role that another tech company — Dropbox — played in pushing the videoconferencing service to address its security weaknesses. Details on Dropbox's role have not been publicly reported before. Many companies, including Zoom, have ""bug bounty programs"" in which they pay hackers to turn over flaws in the company's own software code. But Dropbox, which has integrated its file-sharing services with Zoom, did something novel. Starting in 2018, Dropbox privately offered to pay top hackers it regularly worked with to find problems with Zoom's software. It even had its own security engineers confirm the bugs and look for related problems before passing them on to Zoom, according to the former Dropbox engineers. Hackers have reported several dozen problems with Zoom to Dropbox, the former employees said. These included moderate problems, like the ability for attackers to take over users' actions on the Zoom web app, and more serious security flaws like the ability for attackers to run malicious code on computers using Zoom software. Dropbox also put in its own controls to ensure that its integration with Zoom did not present risks to Dropbox users. In early 2019, Dropbox sponsored HackerOne Singapore, the live hacking competition. To put pressure on Zoom to take security more seriously, former Dropbox engineers said, Dropbox included the videoconferencing service among companies for which it offered bug bounties at the event. Even before the event began, one hacker reported a major vulnerability to Dropbox that could have allowed attackers to pose as Zoom over Wi-Fi and secretly observe users' video calls, the former Dropbox engineers said. Soon after, the two Australian hackers — an engineer and executive at Brisbane-based Assetnote, a security company — uncovered the flaw that would have allowed an attacker to covertly take complete control of certain computers running Apple's macOS, according to a blog post published by the hackers. The discovery was particularly jarring because attackers could have used the Zoom vulnerability to gain access to the deepest levels of a user's computer. But Zoom did not quickly address the flaw. Instead, the company waited more than three months until a third researcher independently uncovered and publicised a separate, less serious issue, with the same underlying cause. Yuan, Zoom's chief executive, subsequently wrote a blog post in July apologising for the delay. ""We misjudged the situation and did not respond quickly enough — and that's on us,"" Yuan wrote. He added: ""We take user security incredibly seriously."" The New York Times Copyright © 2020"," Natasha Singer , Nicole Perlroth ","April 21, 2020"
